{
  "$schema": "../../schemas/bh_required_capabilities.schema.json",
  "schema_version": 1,
  "contract_id": "tttv2_llama3_8b_bh_required_capabilities_v1",
  "model": {
    "package": "llama3_8b",
    "hf_model_id": "meta-llama/Llama-3.1-8B-Instruct",
    "demo_entry_point": "tests/hardware/models/llama3_8b/test_demo.py"
  },
  "authority": {
    "plan": "tttv2_bh_support_plan.md:632-878",
    "integration_contract": "models/common/llm_runtime/tttv2_demo_to_vllm_integration_skill.md",
    "source_files": [
      "examples/llama3_8b/demo.py",
      "src/tt_transformers/models/llama3_8b/hf_adaptor.py",
      "src/tt_transformers/models/llama3_8b/generator.py"
    ]
  },
  "scope": {
    "declaration_state": "pre_acceptance",
    "immutability": "This file permanently declares source-required coverage. Characterization, observations, metrics, floors, and current dispositions live outside this contract and may never remove a requirement.",
    "acceptance_rule": "Each requirement must be resolved in characterization/completion evidence as PASS or explicitly approved APPROVED_UNSUPPORTED_GEOMETRY. FAIL or BLOCKED there prevents completion without mutating this declaration."
  },
  "geometries": [
    {
      "id": "p150_tp1_dp1",
      "ci_sku": "bh_p150",
      "mesh_name": "P150",
      "mesh_shape": [
        1,
        1
      ],
      "dies": 1,
      "tp_per_lane": 1,
      "dp": 1,
      "fabric_config": null,
      "role": "required"
    },
    {
      "id": "p150x4_tp4_dp1",
      "ci_sku": "bh_quietbox_2",
      "mesh_name": "P150x4",
      "mesh_shape": [
        1,
        4
      ],
      "dies": 4,
      "tp_per_lane": 4,
      "dp": 1,
      "fabric_config": "FABRIC_1D_RING",
      "role": "required"
    },
    {
      "id": "p150x4_tp1_dp4",
      "ci_sku": "bh_quietbox_2",
      "mesh_name": "P150x4",
      "mesh_shape": [
        1,
        4
      ],
      "dies": 4,
      "tp_per_lane": 1,
      "dp": 4,
      "fabric_config": "FABRIC_1D_RING",
      "role": "required"
    },
    {
      "id": "p300_tp1_dp2",
      "ci_sku": "bh_p300",
      "mesh_name": "P300",
      "mesh_shape": [
        1,
        2
      ],
      "dies": 2,
      "tp_per_lane": 1,
      "dp": 2,
      "fabric_config": "FABRIC_1D_RING",
      "role": "additive_functional"
    },
    {
      "id": "p150x2_p300_standin",
      "ci_sku": "none",
      "mesh_name": "P300",
      "mesh_shape": [
        1,
        2
      ],
      "dies": 2,
      "tp_per_lane": 1,
      "dp": 2,
      "fabric_config": "FABRIC_1D_RING",
      "role": "development_standin"
    }
  ],
  "demo_requirements": [
    {
      "id": "p150.performance.token_accuracy",
      "geometry_id": "p150_tp1_dp1",
      "profile": "performance",
      "demo_case": "token-accuracy",
      "source_parameter_id": "token-accuracy-repeat_batch-1-prefetcher-off",
      "node_id": "tests/hardware/models/llama3_8b/test_demo.py::test_llama3_8b[blackhole-performance-token-accuracy-repeat_batch-1-prefetcher-off-P150]",
      "dp": 1,
      "trace_mode": "none",
      "context_bucket": 1024,
      "cache_protocol": [
        "cold_write",
        "warm_read"
      ],
      "capabilities": [
        "functional",
        "token_accuracy",
        "quality"
      ],
      "required_resolution": "PASS_OR_APPROVED_UNSUPPORTED_GEOMETRY",
      "acceptance_condition": "Exact canonical node passes on the real required SKU under the performance profile in cold-write and warm-read runs, with nonzero passes, zero unexpected skips/xfails, and required functional, token_accuracy, quality gates; performance gates use independently frozen real-SKU floors.",
      "batch_size": 1,
      "decode_tokens": 0,
      "repeat_batches": 1,
      "report_perf": false
    },
    {
      "id": "p150.accuracy.token_accuracy",
      "geometry_id": "p150_tp1_dp1",
      "profile": "accuracy",
      "demo_case": "token-accuracy",
      "source_parameter_id": "token-accuracy-repeat_batch-1-prefetcher-off",
      "node_id": "tests/hardware/models/llama3_8b/test_demo.py::test_llama3_8b[blackhole-accuracy-token-accuracy-repeat_batch-1-prefetcher-off-P150]",
      "dp": 1,
      "trace_mode": "none",
      "context_bucket": 1024,
      "cache_protocol": [
        "cold_write",
        "warm_read"
      ],
      "capabilities": [
        "functional",
        "token_accuracy",
        "quality"
      ],
      "required_resolution": "PASS_OR_APPROVED_UNSUPPORTED_GEOMETRY",
      "acceptance_condition": "Exact canonical node passes on the real required SKU under the accuracy profile in cold-write and warm-read runs, with nonzero passes, zero unexpected skips/xfails, and required functional, token_accuracy, quality gates; performance gates use independently frozen real-SKU floors.",
      "batch_size": 1,
      "decode_tokens": 0,
      "repeat_batches": 1,
      "report_perf": false
    },
    {
      "id": "p150.performance.batch_1",
      "geometry_id": "p150_tp1_dp1",
      "profile": "performance",
      "demo_case": "batch-1",
      "source_parameter_id": "batch-1",
      "node_id": "tests/hardware/models/llama3_8b/test_demo.py::test_llama3_8b[blackhole-performance-batch-1-P150]",
      "dp": 1,
      "trace_mode": "all",
      "context_bucket": 1024,
      "cache_protocol": [
        "cold_write",
        "warm_read"
      ],
      "capabilities": [
        "functional",
        "performance"
      ],
      "required_resolution": "PASS_OR_APPROVED_UNSUPPORTED_GEOMETRY",
      "acceptance_condition": "Exact canonical node passes on the real required SKU under the performance profile in cold-write and warm-read runs, with nonzero passes, zero unexpected skips/xfails, and required functional, performance gates; performance gates use independently frozen real-SKU floors.",
      "batch_size": 1,
      "decode_tokens": 200,
      "repeat_batches": 1,
      "report_perf": true
    },
    {
      "id": "p150.accuracy.batch_1",
      "geometry_id": "p150_tp1_dp1",
      "profile": "accuracy",
      "demo_case": "batch-1",
      "source_parameter_id": "batch-1",
      "node_id": "tests/hardware/models/llama3_8b/test_demo.py::test_llama3_8b[blackhole-accuracy-batch-1-P150]",
      "dp": 1,
      "trace_mode": "all",
      "context_bucket": 1024,
      "cache_protocol": [
        "cold_write",
        "warm_read"
      ],
      "capabilities": [
        "functional",
        "performance"
      ],
      "required_resolution": "PASS_OR_APPROVED_UNSUPPORTED_GEOMETRY",
      "acceptance_condition": "Exact canonical node passes on the real required SKU under the accuracy profile in cold-write and warm-read runs, with nonzero passes, zero unexpected skips/xfails, and required functional, performance gates; performance gates use independently frozen real-SKU floors.",
      "batch_size": 1,
      "decode_tokens": 200,
      "repeat_batches": 1,
      "report_perf": true
    },
    {
      "id": "p150.performance.batch_32",
      "geometry_id": "p150_tp1_dp1",
      "profile": "performance",
      "demo_case": "batch-32",
      "source_parameter_id": "batch-32-repeat_batch-1-prefetcher-off",
      "node_id": "tests/hardware/models/llama3_8b/test_demo.py::test_llama3_8b[blackhole-performance-batch-32-repeat_batch-1-prefetcher-off-P150]",
      "dp": 1,
      "trace_mode": "all",
      "context_bucket": 1024,
      "cache_protocol": [
        "cold_write",
        "warm_read"
      ],
      "capabilities": [
        "functional",
        "performance"
      ],
      "required_resolution": "PASS_OR_APPROVED_UNSUPPORTED_GEOMETRY",
      "acceptance_condition": "Exact canonical node passes on the real required SKU under the performance profile in cold-write and warm-read runs, with nonzero passes, zero unexpected skips/xfails, and required functional, performance gates; performance gates use independently frozen real-SKU floors.",
      "batch_size": 32,
      "decode_tokens": 200,
      "repeat_batches": 1,
      "report_perf": true
    },
    {
      "id": "p150.accuracy.batch_32",
      "geometry_id": "p150_tp1_dp1",
      "profile": "accuracy",
      "demo_case": "batch-32",
      "source_parameter_id": "batch-32-repeat_batch-1-prefetcher-off",
      "node_id": "tests/hardware/models/llama3_8b/test_demo.py::test_llama3_8b[blackhole-accuracy-batch-32-repeat_batch-1-prefetcher-off-P150]",
      "dp": 1,
      "trace_mode": "all",
      "context_bucket": 1024,
      "cache_protocol": [
        "cold_write",
        "warm_read"
      ],
      "capabilities": [
        "functional",
        "performance"
      ],
      "required_resolution": "PASS_OR_APPROVED_UNSUPPORTED_GEOMETRY",
      "acceptance_condition": "Exact canonical node passes on the real required SKU under the accuracy profile in cold-write and warm-read runs, with nonzero passes, zero unexpected skips/xfails, and required functional, performance gates; performance gates use independently frozen real-SKU floors.",
      "batch_size": 32,
      "decode_tokens": 200,
      "repeat_batches": 1,
      "report_perf": true
    },
    {
      "id": "p150.performance.eval_32_repeat_3",
      "geometry_id": "p150_tp1_dp1",
      "profile": "performance",
      "demo_case": "eval-32-repeat-3",
      "source_parameter_id": "eval-32-repeat_batch-3-prefetcher-off-perf-report-off",
      "node_id": "tests/hardware/models/llama3_8b/test_demo.py::test_llama3_8b[blackhole-performance-eval-32-repeat_batch-3-prefetcher-off-perf-report-off-P150]",
      "dp": 1,
      "trace_mode": "decode_only",
      "context_bucket": 1024,
      "cache_protocol": [
        "cold_write",
        "warm_read"
      ],
      "capabilities": [
        "functional",
        "determinism"
      ],
      "required_resolution": "PASS_OR_APPROVED_UNSUPPORTED_GEOMETRY",